{
  "schema_version": "1.0",
  "publication_id": "test_002_approved",
  "package_hash": "sha256:3dd8c9b0e49b3c2f1d7e8a6b5c4d3e2f1a0b9c8d7e6f5a4b3c2d1e0f9a8b7",
  "destination_id": "tao.wordpress.production",
  "agent": "wordpress_v1",
  "attempted_at": "2026-08-10T14:05:00Z",
  "status": "VERIFIED",
  "remote_id": "wp_post_12345",
  "public_url": "https://taoclinicaltouch.com/article-title",
  "verification": {
    "passed": true,
    "checked_at": "2026-08-10T14:06:00Z",
    "details": "Post found at URL, metadata verified, featured image attached"
  },
  "error_class": null,
  "error_message": null
}
